{
  "schema_version": "5.0.0",
  "document": {
    "title": "Example GA4 tracking plan",
    "version": "1.0",
    "date": "2026-08-01",
    "language": "en",
    "scope": "Product discovery and quote request",
    "target_state": "to_be"
  },
  "data_layer_convention": {
    "name": "Default web dataLayer",
    "origin": "default",
    "event_key": "event",
    "wrappers": {
      "page": "page",
      "event": "event_data",
      "ecommerce": "ecommerce",
      "user": "user"
    },
    "notes": "Clear event_data or ecommerce before replacing a previously populated object."
  },
  "journeys": [
    {
      "journey_id": "product_discovery",
      "name": "Product discovery",
      "scope": "Product detail pages",
      "status": "observed",
      "business_goal": "Understand qualified product interest.",
      "urls": [
        "https://example.com/products/{product}"
      ]
    },
    {
      "journey_id": "quote_request",
      "name": "Quote request",
      "scope": "Quote form",
      "status": "confirmed",
      "business_goal": "Measure intentional quote starts and accepted leads.",
      "urls": [
        "https://example.com/request-a-quote"
      ]
    }
  ],
  "events": [
    {
      "event_name": "core_data",
      "classification": "context",
      "journey_ids": [
        "product_discovery",
        "quote_request"
      ],
      "definition": "Provides the reusable page and user context needed by subsequent measurement.",
      "trigger": "Push on every full page load and SPA route change after page and user state are available, and refresh the same context after an authentication-state change.",
      "locations": [
        {
          "page_type": "all_pages",
          "url_pattern": "https://example.com/*"
        }
      ],
      "parameters": [
        {
          "name": "page_template",
          "data_layer_path": "page.page_template",
          "classification": "implementation",
          "scope": "implementation",
          "type": "string",
          "requirement": "required",
          "definition": "Identifies the stable functional template of the displayed page or route.",
          "value_rule": "Use the normalized functional page template.",
          "allowed_values": [
            "home",
            "product_detail",
            "quote_form",
            "confirmation"
          ],
          "value_evidence_refs": [
            "page_templates"
          ],
          "example": "product_detail",
          "source": "Application route metadata.",
          "destination": "implementation_only",
          "value_mode": "controlled_semantic",
          "value_language": "en"
        },
        {
          "name": "login_status",
          "data_layer_path": "user.login_status",
          "classification": "custom",
          "scope": "user",
          "type": "string",
          "requirement": "required",
          "definition": "Indicates whether the current visitor is authenticated.",
          "value_rule": "Use one of the exhaustive normalized states.",
          "allowed_values": [
            "logged_out",
            "logged_in"
          ],
          "value_evidence_refs": [
            "login_statuses"
          ],
          "example": "logged_in",
          "source": "Authentication state.",
          "destination": "ga4_user_property",
          "custom_decision": {
            "business_need": "Compare journeys for authenticated and unauthenticated visitors.",
            "official_candidate": "No prescribed event parameter represents reusable authentication state.",
            "why_not_fit": "The value is persistent user context rather than the outcome of the official login event."
          },
          "value_mode": "controlled_semantic",
          "value_language": "en"
        },
        {
          "name": "user_id",
          "data_layer_path": "user.user_id",
          "classification": "implementation",
          "scope": "user",
          "type": "string",
          "requirement": "conditional",
          "condition": "Send after authentication when a stable first-party User-ID is available; do not send before first sign-in and clear the GA4 setting with null after sign-out.",
          "definition": "Identifies the stable first-party account identifier mapped to the official GA4 User-ID configuration setting.",
          "value_rule": "Use the stable opaque account identifier; never use an email address or register the value as a custom dimension.",
          "example": "customer_12345",
          "source": "Authenticated account state.",
          "destination": "ga4_user_id",
          "official_source": {
            "url": "https://developers.google.com/analytics/devguides/collection/ga4/user-id",
            "section": "Send user IDs",
            "wording_origin": "faithful_translation",
            "checked_date": "2026-08-01",
            "official_text": "The user_id parameter is a configuration parameter, not a custom user property or standard event parameter."
          },
          "value_mode": "technical_identifier",
          "value_evidence_refs": [
            "user_ids"
          ]
        }
      ],
      "data_layer": {
        "push": {
          "page": {
            "page_template": "product_detail"
          },
          "user": {
            "login_status": "logged_in",
            "user_id": "customer_12345"
          }
        }
      }
    },
    {
      "event_name": "view_item",
      "classification": "official_ecommerce",
      "journey_ids": [
        "product_discovery"
      ],
      "business_question": "Which products and selected variants attract consideration before later commerce actions?",
      "definition": "This event signifies that some content was shown to the user. Use this event to discover the most popular items viewed.",
      "trigger": "Push once after the primary product detail and selected default variant are rendered.",
      "locations": [
        {
          "page_type": "product_detail",
          "url_pattern": "https://example.com/products/{product}",
          "component": "Product detail"
        }
      ],
      "parameters": [
        {
          "name": "currency",
          "data_layer_path": "ecommerce.currency",
          "classification": "official",
          "scope": "event",
          "type": "string",
          "requirement": "conditional",
          "condition": "Required when value is sent.",
          "definition": "Currency of the items associated with the event, in 3-letter ISO 4217 format. * Value metrics on the view_item event to not contribute to revenue * If you set value then currency is required for revenue metrics to be computed accurately.",
          "value_rule": "Use the ISO 4217 currency code.",
          "allowed_values": [
            "EUR"
          ],
          "value_evidence_refs": [
            "currencies"
          ],
          "example": "EUR",
          "source": "Commerce currency configuration.",
          "destination": "ga4_event_parameter",
          "official_source": {
            "url": "https://developers.google.com/analytics/devguides/collection/ga4/reference/events#view_item",
            "section": "view_item parameters",
            "wording_origin": "exact",
            "checked_date": "2026-08-01",
            "official_text": "Currency of the items associated with the event, in 3-letter ISO 4217 format. * Value metrics on the view_item event to not contribute to revenue * If you set value then currency is required for revenue metrics to be computed accurately."
          },
          "value_mode": "technical_identifier"
        },
        {
          "name": "value",
          "data_layer_path": "ecommerce.value",
          "classification": "official",
          "scope": "event",
          "type": "number",
          "requirement": "optional",
          "definition": "The monetary value of the event. * Set value to the sum of (price * quantity) for all items in items. Don't include shipping or tax. * value is typically required for meaningful reporting. If you mark the event as a key event then it's recommended you set value. * currency is required if you set value.",
          "value_rule": "Set value to the sum of price * quantity for all items; exclude shipping and tax.",
          "example": 129.9,
          "source": "Selected product offer.",
          "destination": "ga4_event_parameter",
          "official_source": {
            "url": "https://developers.google.com/analytics/devguides/collection/ga4/reference/events#view_item",
            "section": "view_item parameters",
            "wording_origin": "exact",
            "checked_date": "2026-08-01",
            "official_text": "The monetary value of the event. * Set value to the sum of (price * quantity) for all items in items. Don't include shipping or tax. * value is typically required for meaningful reporting. If you mark the event as a key event then it's recommended you set value. * currency is required if you set value."
          },
          "value_mode": "numeric",
          "value_evidence_refs": [
            "item_values"
          ]
        },
        {
          "name": "items",
          "data_layer_path": "ecommerce.items",
          "classification": "official",
          "scope": "event",
          "type": "array",
          "requirement": "required",
          "definition": "The items for the event.",
          "value_rule": "Send one item object for the displayed product variant.",
          "example": [
            {
              "item_id": "SKU-123",
              "item_name": "Example window",
              "item_variant": "120x100",
              "item_color": "white"
            }
          ],
          "source": "Selected product and variant data.",
          "destination": "ga4_event_parameter",
          "official_source": {
            "url": "https://developers.google.com/analytics/devguides/collection/ga4/reference/events#view_item",